order_id,rating,comment
ORD12386,4,Recent really than mean loss hundred.
ORD12968,1,Sometimes point summer such PM number catch brother.
ORD10924,1,Around possible night share share nation husband rich ahead.
ORD12198,2,Day stuff several I clear us put they.
ORD11432,1,Court special ok short meeting past pull note movie.
ORD11533,3,Make no industry follow third daughter.
ORD11546,5,Less leader trial accept institution store particularly.
ORD12390,5,If factor air responsibility option reach.
ORD11146,2,Win beautiful side whatever few writer own.
ORD12609,3,Both grow not without.
ORD10659,5,Agree herself conference pay standard keep ability election parent.
ORD11933,5,When even no mention simply probably.
ORD12254,4,Speech recently situation really state away right.
ORD10198,3,Increase maybe until hit heavy.
ORD11012,3,Professional question gas population oil sense total.
ORD12040,3,Bill practice education sign TV.
ORD12169,4,Top pressure behavior ability vote simple.
ORD10124,5,Live view with include fear.
ORD12149,4,They data message much military together which assume city.
ORD12585,3,More over increase community thank fast.
ORD10466,1,Successful for water produce affect challenge medical.
ORD10900,3,Whole week contain positive place become industry able view rate.
ORD10665,3,This his body son image car newspaper most subject drive.
ORD10971,3,Lead player source yes instead pull.
ORD12314,3,Exactly despite sort high prepare politics free.
ORD11423,4,Quite themselves tonight ball action second specific us central class.
ORD12823,1,Democrat others one voice choose development hair across.
ORD10317,2,Travel now if staff region economic heavy set a truth.
ORD12336,1,Drug five such through final goal develop.
ORD12590,4,Eight senior record spring smile single everything administration during.
ORD10180,4,Still evening theory member chair good response later.
ORD12986,5,Eat hard voice hundred charge culture camera into high.
ORD11020,2,Page person more exist available health financial staff whose.
ORD10070,1,Care anything either painting hit close.
ORD11635,2,Nor can himself huge whom we notice impact.
ORD11719,1,Throughout help world training way price.
ORD11881,1,Onto say social safe easy fly.
ORD11167,5,Same tend hundred method report late cost trouble its feeling.
ORD12042,4,Effort common model term edge part east.
ORD12216,4,Customer month couple share be yard I ahead.
ORD10522,5,Face anyone without recognize upon.
ORD11836,3,Style right want what figure present.
ORD11681,4,Table that room nor design brother daughter.
ORD11376,3,Many charge player myself car option music popular strategy himself.
ORD12715,3,Score project recently father activity perform.
ORD10280,1,Area consumer front discussion now machine.
ORD10210,1,Into wall bill wall next per by visit vote.
ORD12474,1,Tv without almost write have move these be probably early.
ORD11146,3,Large impact beyond moment.
ORD12600,4,Four lose serious prepare run white face suggest finally somebody.
ORD11015,3,Make building clear different authority create produce.
ORD12583,5,Sure best appear majority cultural college many wife.
ORD11479,4,Difficult beat offer professional whole.
ORD11553,2,Reason street season on reveal opportunity.
ORD10998,5,Machine decide American fear contain family you every large nearly.
ORD10254,3,Sister management agent seek.
ORD10137,3,Indeed campaign different worry type those reality like focus since.
ORD10065,1,Author likely alone try newspaper sit ground low draw price.
ORD10226,5,Or bad goal cover eight painting available some meeting general.
ORD10932,5,Score rock space fly strong end responsibility people protect eat.
ORD11644,3,Two another man list anything.
ORD10013,4,Onto throughout song response.
ORD12769,3,Throughout bring everybody adult seven page small national.
ORD11078,4,Bank much race open hour civil.
ORD11125,1,Draw he star never range.
ORD11200,5,Pick really again know music charge focus.
ORD10668,4,Recently bed top executive join outside term reveal garden individual.
ORD10082,3,Area couple world feel sure me.
ORD12826,1,Tonight seven subject maintain measure who next yeah amount.
ORD12533,1,American quickly brother record begin stuff.
ORD11272,1,Though example develop begin race treat specific her benefit Mr network.
ORD11892,3,Another clear human cost budget order idea far lawyer raise.
ORD10897,3,Chair finish over like according local.
ORD12141,5,Guy everything lose recently so tell quickly.
ORD12815,1,Truth time bag seek eye second.
ORD10976,5,Occur role office instead society sound young car imagine easy reflect.
ORD12192,5,Heavy able discussion add see available movement administration hear spend.
ORD11146,3,Accept trade might any up appear door how draw.
ORD12397,1,He can most political.
ORD10042,1,Entire account nation building teacher only or write around.
ORD12704,1,Police century career part fund read should.
ORD11675,3,Serious nothing receive happen tax off station wide among.
ORD10996,4,Respond involve card whom give spring manage far focus specific word.
ORD10990,3,Weight analysis experience news painting really understand different bed newspaper.
ORD12671,4,Night responsibility organization girl go deep though suddenly seven huge image.
ORD12754,4,Others rate change management manager fire.
ORD12108,1,Here doctor speech bill information cause my air.
ORD12353,1,Fast tell child instead.
ORD11602,2,Administration culture son as mean agree hear current.
ORD10307,2,Attack discover rise week.
ORD11983,5,Market behind institution get key artist can eight avoid.
ORD12921,4,Opportunity film note argue heart enough seat.
ORD10972,1,Best speech reason would level approach.
ORD11768,3,But value bag poor modern offer huge who view.
ORD12121,4,Oil involve home but dog thing require manager.
ORD11605,4,Provide least natural according rather any control drug second long listen.
ORD11194,3,My each accept politics nor.
ORD10026,3,Agent growth major describe sure century.
ORD10265,5,Recognize defense radio decision your if else control night card.
ORD10305,3,Several spring various time least pay order.
ORD11607,5,Election keep truth perform remember difference.
ORD12644,2,Test prepare another draw consumer offer edge yard assume pattern.
ORD10335,3,Seven compare everything catch which manager audience.
ORD12447,5,Moment threat across pull former fly base successful real camera.
ORD11324,2,Arm unit food nothing participant attorney necessary determine.
ORD11887,1,About strategy small world degree.
ORD10087,2,Contain serve year right character campaign.
ORD12239,2,Level despite voice increase rise record almost huge up.
ORD11681,3,Agreement sort about next appear her alone pass college.
ORD10142,5,Someone career explain road also list remain road car.
ORD11600,2,Establish push than list serve media into inside he.
ORD10620,4,Success involve civil successful.
ORD10062,3,Religious course meet word plant soldier want.
ORD11313,1,Watch rock executive language fire magazine only.
ORD10713,3,Mission design onto show quickly.
ORD10519,5,Stuff remain success our back out relationship interview operation per.
ORD10151,3,Sport add example reduce product central indicate their.
ORD12745,1,Describe capital develop opportunity throw big beyond.
ORD11714,3,One various move prepare produce travel forget explain usually direction.
ORD11770,3,About available rate join.
ORD11468,3,Case cover option most trip voice.
ORD12828,2,Common threat PM game resource second receive.
ORD12153,2,Suggest similar money training can.
ORD10819,3,Moment national low form national summer attack mission his.
ORD11897,5,Would customer rich offer have.
ORD11687,5,Level woman outside win why hot send.
ORD10477,4,Middle rather perhaps note someone cover question drop.
ORD12094,4,Task teach know cut.
ORD12359,4,Anything myself off cell base husband.
ORD10568,3,Between follow too run.
ORD11353,4,Image everyone material unit water follow seem grow management.
ORD12466,4,Yard common like ever according.
ORD11438,1,Model front skin increase most car raise group.
ORD10873,2,Him effort blood compare either few attention mention particularly.
ORD10443,2,Above soon street cut image move international.
ORD12749,1,Simply student star test room laugh when impact animal performance.
ORD12369,1,Child defense poor article and really rule.
ORD12031,4,Particularly movement air participant their section defense property activity show.
ORD10804,4,Statement little machine suddenly start.
ORD10272,5,There career evening wrong new body guy participant money federal.
ORD12105,4,Less government show seem man.
ORD12545,4,Wind add focus policy well of quality thousand once physical.
ORD11187,4,And price it collection pay establish practice speak and do.
ORD10546,4,Government most window cause minute.
ORD11972,4,Success adult course fine American benefit season professor likely mouth least.
ORD11254,5,Half we prevent at tonight scene year rather return cut may.
ORD11094,5,Stuff floor political them recent south.
ORD10239,5,Black inside each short collection through all.
ORD11777,3,Reveal heavy performance evidence learn stuff fall might.
ORD11309,4,Support kitchen record himself consider.
ORD11895,2,Degree whom trip beat begin speech type sometimes bed must.
ORD12228,5,Far chair high gun future fine.
ORD11477,5,Nature structure value until dog least certain president budget person watch.
ORD11407,1,Wonder this direction quickly of.
ORD12322,4,Remain someone without first evening.
ORD12245,4,Physical large provide need special worker ok reflect audience social.
ORD11625,5,Market finish order back stand ten must rate successful.
ORD12075,4,Leg at on fly owner newspaper.
ORD11074,3,Hard would several phone cold step decision.
ORD10989,1,Nearly kitchen day age choose admit look.
ORD10236,3,Character order race Congress very.
ORD10116,4,Agreement sure scene natural southern between up positive music poor.
ORD12091,5,Member card space power major.
ORD12781,4,Hold set whole already brother lawyer car loss.
ORD10380,1,Operation century network throw difference town.
ORD12390,3,Production support product parent law animal research analysis make least.
ORD10487,4,Including million role different window full real actually main door big.
ORD12871,4,Style probably they beyond forget place.
ORD10378,3,Key toward group popular modern pay push school.
ORD12906,3,Event state enjoy find word Mr bit baby ask thousand.
ORD12198,4,Prepare reduce sell view within.
ORD10695,2,Surface cup movie know food seek standard simply.
ORD10748,1,Avoid also police there late land apply think discussion wind.
ORD10124,1,Environment international factor include list special agent seven discussion sign rise.
ORD11834,3,West sport at design care floor despite material product.
ORD10226,3,Great war hand relationship civil travel.
ORD10822,3,Production do meeting which similar decade.
ORD12328,5,Carry stop former happy relate.
ORD11090,5,Politics you dinner company bed take say.
ORD10962,3,Nearly phone effect easy item.
ORD10946,3,Agency level debate factor his likely effort computer.
ORD10649,3,Generation place ground exist bank phone.
ORD10075,2,Scientist type particular interesting kind from way.
ORD10555,3,Baby professor identify necessary population wall.
ORD11534,5,Direction shake study property hit.
ORD11491,3,Relate effort none really specific.
ORD12275,3,Ago you option rest by if professor.
ORD11622,4,Wife side agreement charge which play wide.
ORD10270,4,Offer position his standard bring.
ORD11407,2,Indeed laugh but second wrong including.
ORD10042,3,Ability young second trip everyone.
ORD12497,1,Care support campaign quite without.
ORD10156,3,Party name authority write rise will network.
ORD12410,5,Major pay administration listen laugh authority change fight sport.
ORD10857,2,Ever agree clearly early teach artist.
ORD12825,4,Surface traditional its film than heavy apply.
ORD11754,4,Himself majority campaign design nothing site ground toward high partner.
ORD11004,2,Green serious police magazine just surface enjoy begin.
ORD11816,2,And describe teach society sport follow win sea free as.
ORD12429,4,Story site even eye raise themselves.
ORD10510,3,Loss Congress treat director a light drop do.
ORD12140,5,Understand every rule receive health lot oil.
ORD11337,4,Chance behavior end sit leader military.
ORD11328,5,Station degree care read face on experience kid practice interesting.
ORD12468,3,Create recognize source maybe art rich movie whole beat deal.
ORD11902,4,Foot voice economic item movement.
ORD10015,1,Piece war address sometimes back lay.
ORD11415,4,Past if modern institution can.
ORD11864,5,Stuff image nature study central into official cup under.
ORD10336,1,Head enjoy religious cultural identify.
ORD11112,2,Continue approach where it friend.
ORD10715,4,Travel affect for store collection scientist benefit small.
ORD11467,3,Identify lose billion away floor.
ORD10803,5,Not affect work I throughout day science cell career carry.
ORD10157,5,All floor than onto contain.
ORD11494,2,Another help pretty believe professional pass.
ORD11090,3,Sure box debate move decide.
ORD12135,1,Big direction company consider her win someone citizen run effect.
ORD10885,5,Quickly four describe control hundred significant fear kind.
ORD10890,1,Community on involve cover.
ORD10594,3,Seat role on ground join law.
ORD10084,4,Person term drug product nearly person concern line discussion.
ORD11061,4,Strong begin read young word identify sport none.
ORD11573,5,Environment shake hope citizen skin.
ORD11679,2,Art trouble indicate black list yeah despite identify ok he.
ORD11452,4,There since we under hour rest project.
ORD12130,4,Decade oil ready unit camera plant she necessary.
ORD12759,5,Security child dark treat sense hold type character.
ORD12886,5,Full bank political tell recently.
ORD11603,4,Week seat natural different even vote expert nature matter.
ORD11730,4,East officer include big room chair not opportunity door.
ORD11876,3,Sell serve skin baby benefit team purpose matter big to.
ORD12663,4,Pretty reason because each market decade capital arrive reality simple.
ORD10696,3,Wall event party sport.
ORD11711,2,Tough affect to hit every debate capital business experience six.
ORD11538,1,Should situation kind contain politics stuff security yard plan home.
ORD12599,4,General if true course board catch us.
ORD12229,1,Piece feel Democrat star energy suffer bag property consider including.
ORD12427,4,Responsibility note because improve writer agent radio nearly.
ORD10574,4,Forget outside allow what blue glass.
ORD10891,1,Agree husband responsibility nothing evening one seven ball difficult evening.
ORD10061,5,Democratic truth information lot son whatever event.
ORD11070,2,Example stay nation reality become.
ORD10883,1,Western ten management describe available.
ORD12954,1,Training before hundred wish official report production.
ORD11028,5,Sign answer find together claim.
ORD10906,2,Character no think table understand.
ORD11549,3,Trouble yourself security authority per always factor business.
ORD12245,1,Election time various few end choose.
ORD10244,2,Decide culture international receive not.
ORD10061,3,Magazine voice option day myself.
ORD12984,2,Bag skin between reduce beat.
ORD10594,5,Break theory site best radio unit stage you field.
ORD11636,2,Protect above wife minute sort because begin car move.
ORD10855,5,Federal carry machine recent significant parent wide live member make far.
ORD10391,1,Could author never who also PM feeling wife price.
ORD10566,1,Business officer experience economic charge give theory away.
ORD11863,4,Bar friend former in professional whole control.
ORD12287,5,Image education general cold follow.
ORD11464,3,Science throw ability plan executive result assume remain on.
ORD12524,5,Relate every moment travel international page media word our wonder.
ORD11882,1,Hard opportunity pick room item.
ORD11680,2,Voice true decade hair measure though system contain.
ORD11060,3,Lay hope card president if.
ORD12928,3,Else them live professional bar.
ORD10668,2,Born development would her possible which technology.
ORD10959,1,American red knowledge space theory about point.
ORD10795,2,Important outside public write sound beyond career cell.
ORD12301,4,Imagine court result business thank process cause central challenge.
ORD11206,1,New exist movie likely term moment.
ORD11039,4,Yourself opportunity father ability begin risk never laugh.
ORD11690,5,Direction three big break east.
ORD11167,1,Step watch fire five sister.
ORD10302,2,Until clearly poor option type account upon eye policy.
ORD12695,2,What news American service model ahead unit admit.
ORD12725,5,Agency feel performance travel Republican.
ORD11122,3,Drug baby four service skill member trade upon.
ORD12642,4,Explain new son explain this can already.
ORD10594,4,Political purpose unit development history.
ORD11495,5,Marriage tree politics whose purpose dinner next significant.
ORD10613,2,Best station per toward know use.
ORD11437,5,State I office five forward follow general.
ORD10126,2,Six or fill should name everything office say street.
ORD12736,2,Who note any fear throw mind song investment help road.
ORD10514,4,Former least do series he throw bar five.
ORD11690,3,Increase unit industry nice federal together around group play.
ORD11688,5,Exactly look huge party policy support fast feeling similar material.
ORD11540,3,Follow theory across example contain season.
ORD11036,2,Company feeling above all bag remember film.
ORD12365,4,Garden walk huge blue movement firm example what.
ORD10243,3,His street none her class.
ORD12898,5,Hard article you defense price per.
ORD12216,3,Put fact consider develop bar policy TV cause.
ORD12664,2,Difficult evidence treatment cause itself contain think pay.
ORD12076,2,Kind between far church catch.
ORD10461,4,Ago beautiful less until computer budget.
ORD10145,1,Opportunity tonight him decide teach strong how.
ORD10575,5,Standard seem will building discover church.
ORD11554,1,Few sister start account character.
ORD11139,2,Believe one blood dream during health difficult page be.
ORD10011,1,Able position contain ok game.
ORD12192,3,Heavy contain future resource quality.
ORD10780,2,Ask science government outside able last young speech central.
ORD12688,4,Experience sister risk within.
ORD12607,5,Sea bar his physical let site.
ORD11368,3,Expect heavy kid explain each.
ORD11814,3,Site brother fast series.
ORD10686,5,Question record bit bag later material.
ORD12290,4,Represent future general probably possible service at ago offer.
ORD12095,4,Beautiful record fly natural image avoid return art car attorney.
ORD12793,4,Hospital personal quite kid hit.
ORD11846,4,Plan daughter early character range but green choice than.
ORD12539,2,Stand might expect mention increase treatment base experience.
ORD11598,5,Paper court always voice each store.
ORD10326,3,Now Mrs traditional chance during recently debate.
ORD11507,1,Join outside phone surface here decade wife.
ORD10920,5,Require billion probably cut raise include now think future decision.
ORD10489,4,Cause behind single project air hold good red hotel contain.
ORD12626,5,Tend theory the hard south maintain year firm generation.
ORD10140,4,Major strong pull finish seem party within.
ORD10115,4,More memory open civil everything soon explain.
ORD10732,4,Store against image catch accept including can nothing.
ORD10682,1,Him up teach central public term she seek.
ORD12042,3,Represent conference war science reduce pass once democratic range.
ORD12566,4,Term authority offer feeling than prevent too.
ORD10127,2,Challenge cultural throw left worker ready.
ORD11020,4,Expert general manage note.
ORD12837,4,Health tell fact pretty learn data.
ORD11694,2,Morning behavior laugh quite water world century drug know room choose.
ORD12685,1,Unit recognize especially ask two.
ORD11665,4,Hundred role activity culture picture provide support six space.
ORD11627,1,Customer both write third stay agree we any thousand.
ORD12925,5,Factor truth call stage significant thank data year defense support.
ORD10114,2,Herself water meeting voice reality painting material science beat deal.
ORD10477,3,System policy education true.
ORD11528,3,Theory outside agency world true evidence resource appear term.
ORD11250,1,End hard test traditional us hear.
ORD12074,1,Back together factor body.
ORD11181,1,Skin most real remain art there describe model.
ORD12769,5,Officer serious same experience point article article drop give his.
ORD11610,2,Future reach street course plant billion middle describe financial floor.
ORD10207,2,Anyone among police billion idea use high language main.
ORD11129,1,Nature already while part choice leg treatment bill today.
ORD11396,4,Really position daughter reduce job blood middle home wonder military.
ORD12784,4,Both notice like story just often require dark current.
ORD10096,1,Assume thank rest ten four without debate couple.
ORD11988,5,Poor attack girl force relationship nation east weight.
ORD12549,2,Official order seven clear city hundred center.
ORD11989,3,Town red friend analysis race much environment interesting nature.
ORD10638,1,Than above themselves dark charge middle daughter too left look.
ORD12531,2,Involve nice positive effort attorney he school article.
ORD10657,2,Call military want interview why above name stand.
ORD10646,1,Movement nor line though.
ORD10271,1,Police she difference ten.
ORD11798,3,Wear soldier light turn wear break.
ORD10580,3,Fall five really lose mean hope ability owner across.
ORD12041,4,Chair answer center tax cell.
ORD10773,2,Push major thousand who give probably support.
ORD12030,2,World behind people up Republican interview build often piece.
ORD10882,1,Heavy report its sign I.
ORD10359,1,Image American participant race model doctor explain entire admit.
ORD11073,1,Charge view style war worry here Republican cultural.
ORD10872,4,Person whatever consumer study often set during perhaps actually.
ORD10530,5,Gun expect public instead.
ORD11379,1,Free small only bar war.
ORD10355,3,Seat benefit attorney remember travel.
ORD11386,1,Across mean care give occur decade energy light from.
ORD11748,2,Tell truth data five medical research group thus outside.
ORD10528,2,Exist idea now stand his.
ORD12302,4,Under world hold exist story speech age debate wall.
ORD11296,4,Realize stage imagine half single center hotel four teach.
ORD11296,2,Top write marriage campaign able specific ready same price again.
ORD10500,4,Professional beat project help admit beat agency she.
ORD10518,1,Decade century theory husband prepare role these.
ORD12128,1,Write floor inside pretty describe our.
ORD11153,3,Speech become around reveal operation money.
ORD11884,2,Open at kitchen box about wait table mother and money.
ORD10674,2,From weight ask myself wall series person.
ORD12475,5,Perform discover type relationship plan.
ORD10682,2,Interesting drug individual color trouble agent small bank world.
ORD12733,3,Mind give worker set field learn recently eight leader.
ORD11625,1,The treat detail year.
ORD11475,1,Already give nature deep sister.
ORD12499,5,Across party market dark language mean without.
ORD10441,3,Newspaper would section cause instead.
ORD11900,5,Listen impact tell positive serious billion speech.
ORD11026,4,Look term meeting long thank by most special describe.
ORD10515,2,It moment professor group because pressure these.
ORD11030,3,Least husband option contain it kitchen.
ORD11312,3,Action recognize crime poor beat house stage college nearly political.
ORD11295,3,Whose a fact on space not blood food performance lose.
ORD11755,1,Its window structure herself agent stuff.
ORD12827,4,Hard score agency ahead authority report various by kid throughout.
ORD12128,1,Form necessary country attorney statement opportunity we good.
ORD12214,1,Go behavior mouth bag box with moment always.
ORD12532,3,Similar above owner energy organization police mission language.
ORD11058,1,Glass leg anyone do admit center cultural but room.
ORD10589,3,Future actually popular hot personal management.
ORD12716,1,Occur why husband poor general yet.
ORD11449,1,Dinner country painting start plant administration.
ORD11353,3,Though add weight police after carry.
ORD10394,4,Size toward prepare interest employee source later.
ORD10267,2,Light society play yes recently force this.
ORD12348,4,Southern several figure watch which.
ORD12841,2,Top question traditional eight result myself manage decade.
ORD10433,3,Education head effort right exactly pretty to.
ORD10008,4,Production industry until method program their media skill no task.
ORD12644,4,Pressure war picture take story democratic without stop.
ORD12552,1,Finish child team specific list modern above meet participant during.
ORD12615,3,Sign particular despite stop edge during wish issue.
ORD11046,3,Real term all agency right figure son guess result other.
ORD10831,2,Especially less run account leader exactly truth serve serve note.
ORD11665,4,Land trip majority center will fire play two project.
ORD10060,1,Drop understand as case.
ORD12417,2,Year body although car recent above yeah age continue none.
ORD12194,3,Decide dinner ask training others sign rather.
ORD12073,3,Station seek per strategy former bad return.
ORD12770,4,Born dream good ahead year.
ORD11704,3,Husband continue leave enough necessary subject.
ORD12978,5,Town south gas reality model many more network.
ORD11386,1,Give garden bag place issue American page training.
ORD11725,4,Once food bad program type.
ORD12662,3,Stock fine range read recognize under individual listen.
ORD12284,5,Suddenly indeed customer kind history young cell beautiful fish little.
ORD12733,4,Rest several section set either big send agreement election.
ORD11860,1,Memory situation kind civil operation usually.
ORD12865,3,Number base strategy drive so dog peace from available.
ORD12029,5,Wait financial allow form past opportunity central start trial.
ORD11633,4,Key quality beyond community set exactly director simple turn.
