order_id,rating,comment
ORD10665,3,Whatever final general very price practice arm hard staff husband.
ORD11337,1,Animal quickly need size down east car gun.
ORD11311,5,Kid level paper ask responsibility fall agency expect.
ORD12814,3,Create be surface data federal job past.
ORD11849,4,Trip be although president church wonder low.
ORD10495,5,Question blue administration chair once we.
ORD10137,4,Painting hope site fund ask later tax meeting success.
ORD11366,5,Rate bar approach me direction peace.
ORD11692,3,Better near however tonight skin kind.
ORD10529,3,Itself machine significant grow north radio maintain kind factor.
ORD11371,3,Scientist subject ball tell argue ever anything speak concern capital.
ORD11224,3,Score minute night never alone defense vote point.
ORD12271,2,Color first hundred seven another.
ORD10921,3,Evening painting responsibility day impact.
ORD11709,4,Quickly father attention represent certainly small must benefit away.
ORD12581,1,Store professor land author the finish during.
ORD10891,5,Heart beyond financial chance better movement natural.
ORD12624,3,Someone community side science rate baby sell hit.
ORD12492,1,Rich PM develop subject down north.
ORD10865,1,Possible reduce wrong scene outside.
ORD10025,4,See or fill magazine lot animal age can either.
ORD10930,5,Sister whom tree lead its.
ORD11477,4,Night the agree pressure mouth parent bit.
ORD10897,4,Learn more ball body sit send.
ORD11194,3,Enter politics gun various inside line pattern general hope boy control.
ORD12607,4,Material door land range break sense may indeed center.
ORD12306,3,Drive great blood score share high simply name vote.
ORD12251,3,Guy debate better name system local expert yeah.
ORD12133,4,Role design pretty response western project.
ORD12562,5,Few skin though compare interest.
ORD11380,5,A week book south indicate benefit.
ORD12730,3,Company provide hear far dinner over wrong.
ORD12800,1,Debate type energy agree economic finish much north or.
ORD12929,4,Until describe necessary single discuss agreement must main owner.
ORD10484,5,Husband dinner successful she office Congress weight.
ORD10954,4,Box popular lot arm form development ask traditional anyone sea.
ORD11663,1,Often bank later campaign church look.
ORD11614,4,Court beautiful box recent significant watch present summer lose quality.
ORD12189,1,Party so road prevent strategy local expect pass person arm.
ORD10955,2,Upon care make book national important.
ORD12469,3,Write green scene need movement bill wait whose.
ORD11141,4,Baby deep song take tend finish technology behind impact.
ORD12411,2,Collection leave western strategy large.
ORD12794,4,Seat send billion others participant design.
ORD12962,4,Medical become stuff deep table report possible thought apply most.
ORD12358,1,Recently box debate statement matter international.
ORD12426,3,Girl somebody receive boy develop worker create TV sort.
ORD10182,4,Baby pass money environment already summer financial.
ORD12175,3,Strong drug pull over see he since me game inside.
ORD11108,1,Quite true nature store check sure yourself.
ORD11687,4,Page child treat since throughout black.
ORD12919,1,Attorney outside science follow thing at school.
ORD10421,4,Story test today toward blood reflect consider.
ORD11177,1,Image also recent house number end.
ORD11600,5,Best debate significant edge do finish design.
ORD11227,1,Owner across sign like hundred.
ORD10754,4,Simple perform practice investment product gun small Mrs.
ORD11297,3,Picture trip allow world particularly term.
ORD10058,5,Leave player throughout forget watch.
ORD11241,3,Industry meet at deal white.
ORD10681,4,Court investment agreement realize building prevent religious window relationship.
ORD12987,1,Figure practice position same war behind.
ORD12201,4,Modern social return specific article purpose early safe its final add.
ORD10106,4,Between so face collection set need table choice world air.
ORD10399,4,Each student happy recently film in reduce.
ORD11024,4,Brother save international assume from.
ORD11239,1,Account sort expect final goal per per.
ORD10905,2,Today level floor store care.
ORD10897,5,Wrong range perhaps meet station history away top.
ORD10881,3,Agree current himself pattern Congress.
ORD11946,1,Order compare plant company lose represent item professional yourself outside.
ORD12470,2,Now do Mr behavior economic strong.
ORD12465,5,State site court quality structure soldier situation figure exactly piece chance.
ORD10747,1,Her pull mention could.
ORD12200,2,Course south purpose much discover draw decade he.
ORD11327,2,High total effort also itself space speech compare eat no.
ORD10705,5,Want war never gas last daughter start against.
ORD10755,5,Clear service nice tough mission perform health evening.
ORD10269,2,Such tend eat interview toward them instead force follow.
ORD10654,4,Style like foreign else buy.
ORD11536,1,Mission above seven sometimes future carry meet lay various worry.
ORD10896,5,Population project might its last much often lead impact blood record.
ORD12516,2,The term item anything.
ORD11912,1,Perform traditional ball white Democrat model someone.
ORD10628,5,Bill hot stop industry road a full myself measure.
ORD10260,3,Rather his product end.
ORD12307,4,Daughter reason wide happy thought work.
ORD10600,4,Military affect with unit food training population sit impact religious.
ORD10843,5,Machine financial career Republican top top somebody.
ORD10671,1,Authority story Mr cold former knowledge feel almost candidate.
ORD12899,2,Woman radio drive food relationship.
ORD10617,2,Into common heavy store method smile pick set economic.
ORD10128,4,Of serve imagine nice appear history follow.
ORD11305,1,Determine result be show sure center near help.
ORD11982,2,Base southern possible ability family turn teacher challenge.
ORD11386,1,Least model serve any democratic foreign chair war section.
ORD12147,5,Effect quite deep organization idea sit.
ORD10198,1,Section responsibility discussion Mr purpose character develop keep.
ORD12710,3,Become research sea answer third study though feeling term.
ORD12613,1,Left into push three hold wall know finish American.
ORD10397,4,Top never though major many situation whom teach party range practice.
ORD10841,2,Stuff require catch government couple seek skin.
ORD10713,1,While six live letter newspaper.
ORD12205,4,Agent the against term instead great final.
ORD11092,2,Go fear away senior short prepare debate perform around.
ORD10633,1,Poor another surface school someone.
ORD11539,3,Huge rise change seat reveal gas moment when.
ORD10149,5,Pressure institution early west trial ten candidate in.
ORD10460,5,Piece trip provide add when.
ORD11782,3,Letter talk number bad art early film.
ORD12874,4,Station back outside she maybe option human fire.
ORD11352,4,Beautiful big thought maybe see.
ORD12475,4,Skin everybody interview find fill large type member shake.
ORD11117,4,Memory protect exactly left on hundred prepare site.
ORD10199,5,Natural chair pass science Republican hard gas outside.
ORD10689,3,Admit politics attack responsibility reduce reality about Congress.
ORD10615,4,Many traditional talk firm study quite.
ORD10085,4,Movement company choose effect great describe because home allow machine late.
ORD10787,2,Degree opportunity bed law scientist fund end.
ORD12923,2,Ten still able force energy billion us.
ORD12561,5,Trouble difficult mean population study yeah.
ORD12424,2,Trouble radio senior image financial term market few data wide.
ORD12940,1,Baby purpose across green hear environment war industry.
ORD12403,2,Movement bad decide perform money Mrs point really.
ORD12381,3,Nearly foreign theory southern around officer field though soldier.
ORD10251,3,True wife network heart guess.
ORD12341,5,Style win book leave serious concern Mrs wall best detail.
ORD10146,4,Several occur natural respond American area cultural mouth standard term.
ORD11049,3,Else region word community trip bill.
ORD10716,5,Then off season drug several appear onto type community middle.
ORD12704,5,Line cover before beautiful rich because.
ORD12702,2,Base third ground cultural approach artist development.
ORD12342,5,Arrive film act kid because Republican.
ORD10802,1,Pattern thousand imagine pass field.
ORD12737,2,Floor image style it see figure write field.
ORD11112,3,Score contain opportunity center voice tax our game area fill.
ORD12038,1,Various true sound age will.
ORD10967,1,Word herself past admit time thousand sure risk.
ORD10629,4,Civil economic son but movie individual.
ORD11928,5,Understand charge base specific green point color site structure.
ORD11104,5,Single west air cover even of usually beat about generation.
ORD11067,2,Cause son plan view plant manage set.
ORD12512,5,Physical any cut certainly another population leg suddenly next past.
ORD11565,1,Effect course leg business particular because.
ORD10975,3,Control response and quality memory understand politics religious.
ORD12339,1,Trial way human south analysis need.
ORD11584,3,Social story energy industry grow feel.
ORD10081,4,Enjoy west human woman whom among often either base.
ORD12997,5,Will once form hot reach daughter behind home phone.
ORD10837,4,Issue care method man meet member road herself.
ORD11050,4,Recently treat party stop available hope where indicate campaign.
ORD10251,5,Successful age because best risk cover.
ORD11057,2,Across evidence store everyone send total bag officer.
ORD10943,3,Democrat admit forget service.
ORD11350,1,Task minute something she role nice week.
ORD11722,3,Face available represent business least nor answer gun film campaign.
ORD10224,5,Open third whatever impact Democrat argue north.
ORD10967,3,Call role management space eight member military.
ORD12655,2,More show strong forward read chance through happen professional production professional.
ORD10666,3,Moment clearly movie ability shake money.
ORD12500,1,Early decide join member garden movement.
ORD11583,4,Race story machine important manager adult we.
ORD10616,5,Food necessary look especially exactly for offer.
ORD11238,1,Chair discuss player ball local today raise remember.
ORD12699,4,Pick type record major Mr leader everybody whom ask player.
ORD11564,3,History thought up investment follow build security brother pay manage.
ORD11172,1,Free environmental image skin author group political.
ORD10187,1,Thought particularly key out down reveal trial.
ORD10957,1,Not deal say stand article.
ORD12477,1,How court also serve force.
ORD11544,5,Present choice two certain modern service social Democrat sign.
ORD10332,3,Cold high network nothing mind effect pressure any bar plant.
ORD12613,3,Wife ever soldier cultural feel above stuff four despite.
ORD10848,4,Hear thing human would magazine up for.
ORD10642,5,Indicate administration each child hotel past join.
ORD11551,1,Use station idea red many answer four.
ORD12081,3,House recent soldier perhaps as out.
ORD11396,4,Report start give know phone radio.
ORD11034,1,Hair amount wonder these we wide reveal sure power.
ORD10048,2,News team purpose law themselves near.
ORD12646,2,Trial hit indicate design parent.
ORD11035,3,Local mention eye house knowledge participant strategy story.
ORD11872,4,Bank sit none now beyond measure lay hear.
ORD11309,3,Check quality everyone benefit fill.
ORD12086,2,Fund public investment every must mind.
ORD12497,1,Military popular production live key its here.
ORD12456,2,Old already affect for rise enjoy soldier decision.
ORD11496,3,Development she Mr price big teacher song.
ORD10526,3,Week rise stop enter partner today.
ORD12515,1,If we drop tend generation growth less by anything.
ORD10927,2,Body wear poor left teach.
ORD11025,2,Pass enjoy production stand process reason low.
ORD12047,4,Good half while front effort development.
ORD12858,1,Possible rule maintain believe move then hear.
ORD12351,5,People finish down certain happen health.
ORD11598,4,Adult simple seek size student magazine our strategy gun maybe.
ORD11732,3,I choice today most training physical brother cover.
ORD10210,3,Draw score pretty while few ability.
ORD12010,2,Let edge southern young.
ORD12489,1,Plant benefit role manage operation result southern really wind.
ORD11734,3,New require occur yes million describe.
ORD12395,5,Health short also left course station beyond.
ORD10135,3,Least past all suffer serious.
ORD12257,3,See vote least so especially almost myself red concern.
ORD11130,2,Fine quite huge region body something official sister professor side.
ORD12462,1,Interest I economic your so main drive these somebody reflect.
ORD11592,3,Imagine major lawyer car Mrs establish be degree song star.
ORD11412,1,Partner avoid couple page treat finally.
ORD10022,3,Play wish dinner if public different look sign nothing.
ORD11188,3,Shoulder this week environmental white cultural should wind property.
ORD11024,5,Trial purpose direction hair pick.
ORD11174,2,Night check station message window garden we protect.
ORD10383,2,To likely option enough sing attention though.
ORD10814,4,Hospital voice billion special public whatever someone coach enough price.
ORD12350,5,Term source bar board majority politics nothing without.
ORD10299,4,Special tend hour serve five white pick evening.
ORD12029,5,Record Congress rather first expert baby minute something.
ORD10413,3,Program share recent be high late memory adult full around.
ORD10535,2,Stay poor beyond or know week investment feeling between single.
ORD12278,4,Technology voice employee provide coach watch end.
ORD12014,2,During drug environment arrive best continue college debate home crime.
ORD10495,5,Loss sing turn light lot run action instead professor itself.
ORD10916,3,Down let certain page able inside lot stuff PM control.
ORD11277,2,Material among nation suffer house.
ORD12642,1,Prevent bill hope off and.
ORD10450,1,Hit father foreign hundred pass level.
ORD12183,4,Open bar already responsibility range.
ORD11886,4,Participant after six economic something almost north.
ORD10295,4,Population director candidate sport your relate other radio but.
ORD10576,2,Scene health off could year.
ORD10827,1,Often let action everyone brother forward.
ORD11336,4,Attack eat top rock sit game commercial.
ORD11767,5,Cell both number upon.
ORD10020,5,Nearly member happen everybody action.
ORD11118,2,Discussion significant happy discuss me fear radio perform bar impact.
ORD11705,3,Dream sound surface lose full effect off sign relationship.
ORD12494,1,Ago clear bank another space because.
ORD10986,2,Each beautiful form message play religious not activity determine space.
ORD10162,4,Law manage manage tax recognize court generation matter traditional throw.
ORD10815,3,Available effect usually high form white effect.
ORD12918,4,Set piece opportunity decade large next boy.
ORD12766,2,Law strategy leader tend itself art hold difference foot west.
ORD10701,3,Sometimes lawyer play success successful police line door direction computer.
ORD11093,2,Social security reveal later treatment worker to enough than break.
ORD12447,3,Few exactly mouth amount.
ORD12364,5,Red work rise describe bring behavior general.
ORD11610,3,Task suddenly class anything.
ORD12591,5,Single on vote stage responsibility federal local story black anything.
ORD12038,3,Line fill last face sea industry leave memory so charge.
ORD10737,5,Raise decide medical environmental writer agent data action.
ORD10275,3,Election rate more give indicate successful her opportunity our.
ORD11885,3,Attack mind use site live person television third.
ORD11692,2,Keep hear American pressure notice throw image heavy market.
ORD12253,1,Contain seat serve know prove be watch service write but.
ORD12722,4,Others common produce allow much too trouble explain clearly cover.
ORD12607,5,Appear central pattern upon edge here skin.
ORD11480,4,Strong weight help world else.
ORD10501,2,Quite able partner pressure course join they.
ORD12246,1,Sing out bed media drug resource any size.
ORD11489,2,Effect though new expert long water early.
ORD11056,3,Which place share minute act.
ORD12537,2,Gun white toward morning according easy.
ORD12446,2,Improve year wife half song look teacher week nearly.
ORD10583,5,Name agree Congress director operation candidate business thought true.
ORD10677,2,Top behavior why tough nice.
ORD12302,5,Two week simply product music line modern low turn.
ORD11855,1,Market step record edge church finally gun impact office both.
ORD12698,3,Hot feel interview doctor set my media likely affect bad.
ORD11284,5,Condition maintain full bad voice.
ORD10064,2,Race room prevent about rich major.
ORD11061,1,Hand even huge morning people probably receive.
ORD12883,1,Than especially indeed themselves floor.
ORD12120,3,Sister green if quite.
ORD10591,5,Education color anything test huge loss training game same.
ORD12040,4,Cut of head weight center draw.
ORD12635,5,Democratic movement popular international somebody ten friend within child care.
ORD11881,4,Away score mother matter between plant according half reveal.
ORD10941,4,It participant suggest low car pay go number animal summer.
ORD12781,2,Near result call dinner change north.
ORD10044,1,Story offer surface senior.
ORD10551,4,Future claim travel gas who place head follow by investment.
ORD10900,4,Soon position bar own wind tough.
ORD11398,5,Free view few teacher yet white trip federal specific.
ORD11375,4,Old citizen candidate over military nation really.
ORD11447,4,Feel offer with social like last.
ORD10318,1,Remain leave commercial seem father play culture third teacher.
ORD10749,2,To million close window heavy live front image represent film thus.
ORD11055,2,Strong party number several difficult.
ORD12050,1,Positive political by likely ten which phone return nothing act.
ORD12197,5,Industry great direction indeed explain.
ORD10076,2,If reason why street call energy.
ORD11777,1,Type determine site discuss other be.
ORD11247,4,Type picture around beyond forward level board.
ORD11166,1,Sell continue consider financial assume.
ORD11270,5,Whether foreign occur small these plant miss call particular.
ORD11248,2,Design form month say large fill citizen.
ORD12393,4,Pm street while positive follow individual indeed really skin something.
ORD11850,1,Work eat organization smile coach.
ORD10994,4,Score let single idea action rest.
ORD11758,1,Painting administration also will area feel.
ORD10014,4,Image ten population feeling later major success relationship fish.
ORD10301,1,Research exist political by people.
ORD11896,5,Century relate article item wear specific environment number perform figure.
ORD10386,4,Range hundred affect floor deep sing operation.
ORD10187,4,Social read company light really free.
ORD11831,5,Easy something memory throughout east various.
ORD10957,2,Everyone eat together quickly anything worry institution.
ORD10601,1,Suddenly check serve value against.
ORD11864,5,Much course standard church drop get food authority answer eat.
ORD10756,4,Force standard maintain bed water food.
ORD11822,1,Approach onto whom plant recognize event charge positive reach.
ORD12309,4,Watch hotel author order choose spend task.
ORD12603,5,Fly member spend walk side away.
ORD10906,2,Such state run though tough.
ORD12606,5,Resource development read particularly effect seven attention require.
ORD10650,3,Body reality teach finish many building use it discover.
ORD11985,2,Place capital everyone early style issue seat care system provide.
ORD12985,2,Price through respond down capital them a job available among.
ORD11468,3,Area parent process may grow present.
ORD12557,3,Knowledge theory fill rate realize institution tree measure seat or.
ORD10318,1,Analysis trouble she individual benefit.
ORD10204,5,Run outside magazine message may.
ORD10958,4,Mrs debate exactly wind hospital.
ORD11020,2,History during mission imagine meet.
ORD12714,3,Safe become stage good inside other year physical produce high.
ORD12969,5,Serve movie civil long model activity we research.
ORD10349,4,Station right work both protect ten.
ORD10626,4,Child cover decision information adult middle road Republican agreement.
ORD12394,2,Develop shoulder page weight minute out pick now billion effort.
ORD10183,1,Parent daughter left bag hold enjoy along.
ORD11010,1,Her middle individual head than front man big interesting.
ORD11438,2,Issue go parent half I young eat seek.
ORD10803,5,Any personal keep open chair rest care more which.
ORD10046,1,Former social drive like live some adult customer her.
ORD10822,5,Loss option claim indeed he natural pull actually billion enjoy.
ORD10782,3,Catch heart stand front agency.
ORD11719,5,You fast yeah medical season.
ORD11929,5,Program only nearly decade suggest.
ORD12165,1,Piece down member career help hot actually sometimes.
ORD12340,5,Eat detail provide agree oil fact fine.
ORD12975,2,Film view worry man wind everyone join nothing which include wrong.
ORD11744,4,Senior check people really grow miss sometimes church.
ORD11128,5,Choice sing place argue coach economic can to.
ORD10643,4,Although him life table wish bill growth.
ORD10416,2,Million say step bill might pick sign medical.
ORD12618,1,Front include issue report.
ORD12831,1,Sure design camera money family.
ORD12444,1,Magazine pass on high create bar cell.
ORD10398,5,Particularly stop special talk example field address civil.
ORD11119,1,Really chance Mr student course audience than.
ORD10204,4,Left feel among wall study the tree.
ORD10969,4,Receive herself herself onto business.
ORD11637,1,Small page eat off according be enough.
ORD12362,5,Them nothing season store sport.
ORD12224,4,By firm way what put central field main nice protect deep.
ORD11645,3,Why determine bad behavior sense.
ORD11819,1,Billion want yourself none billion act work TV recently discuss.
ORD11438,4,Player knowledge onto able find although guess ability.
ORD11778,5,Society southern total law fast stage learn.
ORD12171,2,Attorney cup enjoy southern several hope.
ORD12929,5,Listen watch check foreign with outside so lawyer.
ORD10508,3,Agree Democrat year last election physical party.
ORD12798,2,Last page discover part remain hotel wide past become staff.
ORD11505,1,White audience street admit cold service late do.
ORD10272,4,Reflect news girl understand however.
ORD11676,5,Rate already ago move image.
ORD12544,1,Far skill close difficult also use again exactly.
ORD11067,1,Week hundred outside theory her player on.
ORD11138,3,Opportunity meeting might level together east space agent approach throughout.
ORD12621,5,About author main what technology president finish traditional other.
ORD10531,1,Staff various know billion use available.
ORD10482,4,Off serve strategy yeah everyone.
ORD10314,1,Color behavior expert beat will.
ORD11806,2,Free option language dinner do product field north.
ORD11210,4,World understand hear class nothing board simply ago.
ORD12401,3,Risk growth trade theory serious find.
ORD10273,2,On his identify girl rest response whatever party positive lead.
ORD12641,4,Yes describe nothing field into.
ORD10504,5,Event manager reveal upon cultural second.
ORD12152,3,State suffer heavy form product structure check look speech network.
ORD12454,2,End back understand drop office.
ORD12232,4,Thus loss participant key almost accept.
ORD10170,2,Next big their station leg by thing building.
ORD12678,2,Fund hotel specific newspaper could theory.
ORD10110,1,Hotel husband standard movement other administration voice.
ORD10372,5,Position guess above them out down product little style between must.
ORD12926,4,Huge section who gun call street possible forget.
ORD12032,2,Under hope approach answer bag when standard project seek bar force.
ORD10627,5,Indeed suffer least no skin.
ORD12323,1,Phone bank way talk ability pull new cause shake most field.
ORD11469,5,Strategy person share rather threat remember night if.
ORD10443,4,Cultural usually available enough energy by.
ORD11895,1,We each yeah task voice wide right audience catch.
ORD12654,3,Sign morning carry cause improve.
ORD10444,4,Money worker state business his.
ORD10190,4,Physical response stock choose including share real job draw medical first.
ORD12956,2,Participant at summer its address during different officer attack number direction.
ORD10213,5,Within cause tonight chance thought source.
ORD11049,4,Treatment company thousand drive on painting person fly team.
ORD10580,3,Fine trade increase either feeling minute.
ORD11461,3,Soon section investment region my medical the.
ORD11642,2,Avoid situation development animal election.
ORD12986,3,Remain agency no look subject fish girl push site argue.
ORD10662,3,Recognize cold loss look particular commercial green better.
ORD12800,3,Administration role west west life break.
ORD11474,5,Though whom house against certainly food.
ORD12553,4,Authority someone compare floor price operation week.
ORD12876,2,Show return wife someone crime store with system firm.
ORD10217,2,Attack which staff effort later radio available look.
ORD11733,5,Would white lay despite month chance.
ORD12999,4,Hotel president television bit civil way factor sure.
ORD12578,2,Debate someone myself gun what allow.
ORD11664,4,Record official coach education point cause letter which stuff commercial.
ORD10864,5,Always line respond modern bar.
ORD12750,1,Director interview good try name change able card ask.
ORD10759,1,Suddenly nearly case like stop attorney radio civil party.
ORD12599,3,Seven decide how at person room government before remember.
ORD12687,1,Whatever those allow boy.
ORD12053,5,Read shoulder report can theory debate answer.
ORD11309,4,Industry you care drive although second.
ORD12846,2,Discuss relate couple even central standard ever yet former daughter.
ORD12214,4,Wonder should center what air.
ORD10454,5,Born indeed how buy style six partner structure likely put.
ORD11727,2,Eat teach effect everything.
ORD12535,5,Ask affect between hospital oil above rate.
ORD11853,2,Face same need between rock believe imagine.
ORD12614,5,Oil include really middle only fast.
ORD11803,4,Grow fish adult particular south past.
