order_id,rating,comment
ORD12981,2,Better responsibility crime form class former civil each class.
ORD12670,3,Very food study cover lay knowledge fight glass even arm.
ORD12065,5,Market identify voice second put other another.
ORD10261,2,Beautiful trip simply stage floor.
ORD11672,4,Strong leg region need concern American bar knowledge mother.
ORD10833,1,Wide after training grow.
ORD11125,2,Through medical religious or brother myself attack threat successful step.
ORD12520,4,Concern yard detail whatever foreign realize.
ORD11332,4,Produce hair these and say good image.
ORD10276,5,Knowledge outside work because quite size writer something.
ORD12442,5,Adult figure former in central them foot.
ORD12112,2,Because home near without support.
ORD10555,1,Now treatment although series there process who consider since cut.
ORD12798,3,Organization heavy account method evening item security candidate medical official.
ORD12651,2,Only return according write many hospital black bring east student.
ORD12870,2,Sense look this suffer call black trade foreign hour any.
ORD12671,2,Deep quality security think quality think certainly.
ORD10597,3,Safe white night pass however present national short.
ORD11589,4,Wide level recent anything training nothing population.
ORD12577,1,Down onto past woman sure wall president father everybody.
ORD10724,1,Range politics education son everyone sure amount idea town.
ORD12907,4,Season career policy unit expect discussion.
ORD12791,3,Store year board hospital view safe economic often try.
ORD10270,1,Tv middle western PM television scientist.
ORD10200,4,Speech region occur investment media fire medical development public.
ORD11311,3,Indicate worry need her moment you design fill.
ORD10670,1,Major western decision you present.
ORD11934,1,South style letter hold they.
ORD12727,1,First agent phone man movement hold.
ORD12526,1,Chance culture represent focus add tough.
ORD11048,4,Ok page candidate never radio amount cost beautiful.
ORD10763,5,Upon raise hotel crime learn finish.
ORD11260,3,Speak expect late energy ready could why early.
ORD11420,3,Maintain factor society form almost drug ground happy reason.
ORD10452,2,Tree chance American box edge.
ORD11345,1,Individual finally view society nor son.
ORD11038,4,Book civil necessary economic production behavior play local.
ORD10418,3,Successful foot join if.
ORD11394,2,Collection change without power prevent place.
ORD10415,4,Hit exist newspaper good provide view he food.
ORD10969,3,Oil anything wide defense four according marriage should.
ORD10807,2,Soon find soldier discussion carry improve worry office over enjoy.
ORD12675,3,Along mind reason station hundred help produce standard.
ORD11511,2,Way interest upon admit water contain.
ORD10446,5,Nor hear front age bit.
ORD11249,5,Also poor trouble agency return what question common argue once.
ORD10633,2,Education particularly lead out thus treatment.
ORD12437,4,Consumer available power rate sense stand open play.
ORD10344,2,Scientist church turn situation participant.
ORD12203,4,Able front agent be community.
ORD11493,3,Among argue nice this memory present know evidence law.
ORD10892,5,Firm per food save movement.
ORD12130,1,Smile three value artist cover city produce store section.
ORD11074,1,Whether wonder cold wish network.
ORD12709,5,Else region hand often case thing make.
ORD10138,4,Suddenly indicate realize affect.
ORD11647,1,Though week key reason either staff garden gun design.
ORD11835,1,Letter economy manager town end kid special recognize evening fish.
ORD12598,3,Leader test yes beat toward method parent well check.
ORD11839,2,Choice mission somebody carry someone chair husband.
ORD11989,1,Religious sense either join ability.
ORD10358,4,Tend avoid middle interest free rock.
ORD12436,2,Myself action cut ready white husband figure line.
ORD11040,4,Study player certain old course but company seven energy news.
ORD12928,3,Draw health rate bar human adult officer beat.
ORD10591,3,News energy after key us budget ability method rich hundred the.
ORD10151,3,Happen always level billion we.
ORD10785,4,Still around difficult interesting nature health kind here record.
ORD12453,2,Include prove foreign attack alone stock understand.
ORD10352,3,Put anything blood new gun.
ORD11051,3,Activity answer girl eye list rather.
ORD11200,3,Director radio compare bank wrong common top likely toward so list.
ORD12814,4,Purpose president team free discover out fly term write.
ORD10188,3,Effort set get himself question past score.
ORD12149,1,Argue bar exist glass responsibility kid.
ORD12187,1,Wait skin surface behavior together.
ORD12714,5,Draw visit work should than smile.
ORD12425,5,Score sign rather language move sea too short.
ORD11397,2,Study floor market because.
ORD12846,5,Feeling price son minute past hospital meeting every open.
ORD10329,4,Middle deep standard front husband.
ORD12900,3,Same purpose know enter agree pay newspaper.
ORD11206,5,Consumer hear during certainly kid option.
ORD12162,3,Top bed while treat million.
ORD12743,2,While economy quality today particular.
ORD11122,3,Others stand baby ground officer brother program appear.
ORD11240,1,Rich cup every view mother there always choose prevent.
ORD11789,3,Enter get whose manager usually across surface fast step.
ORD11260,2,Military this machine social ten responsibility cell ask serve example.
ORD12201,2,Participant music land hit far on very.
ORD12787,1,Loss natural edge listen some.
ORD12599,4,Ball involve leader material movement speak.
ORD11771,2,Song perform today interest ten stuff people me.
ORD10436,2,Lawyer year modern wait former everything mention third serve whom dog.
ORD12414,2,Break particular yet reveal.
ORD11667,4,Yard worker indeed three about foreign own consider law professional.
ORD10041,3,Write ok economy time middle.
ORD12143,3,Book style success month skin.
ORD12173,2,Page instead small glass budget thought wonder important sound.
ORD10713,2,Relate red drive to whom specific.
ORD12295,3,Price friend education air firm.
ORD10974,4,Bill along religious last under drop apply.
ORD10677,4,Whether computer those practice seek man Mr player class.
ORD11860,3,Lead them industry technology son black personal.
ORD11846,1,Myself add name control tough much.
ORD12126,4,Town indicate five think get.
ORD12876,2,Former husband discuss item remember fast mission agreement pick nearly.
ORD10573,4,Compare cause visit trip model music item among understand street.
ORD11798,3,Evening operation resource moment financial Mr three year subject wrong large.
ORD11669,4,Foreign and bad detail purpose.
ORD12851,5,Music term least society senior cold second truth debate item high.
ORD10884,3,Woman camera kind their lose home into must professional.
ORD11444,5,Control century leg her ahead during according yes.
ORD12597,4,Large difficult environmental wide what account consider Mr statement.
ORD11098,1,Point get thank series what region lose.
ORD12273,1,Three community west can sound stuff matter research.
ORD12280,5,Argue former fund ground once.
ORD10444,5,Article call left seat protect call.
ORD10491,3,General under large treatment fine clear effort shake wife former.
ORD10696,5,Face improve page smile range wonder somebody throughout.
ORD11551,2,Power fall billion live newspaper take attorney small instead.
ORD11480,5,Hundred population do hospital skill them herself.
ORD10729,1,Father whole method until.
ORD11716,3,Second issue second debate Republican perhaps audience.
ORD11239,1,Exist own good let ready ahead.
ORD11489,5,Through dream past vote old or success where instead.
ORD11583,4,Major agency new follow arrive.
ORD10763,5,Want another teacher each memory really.
ORD12427,5,Return mean before service century difference green.
ORD12500,1,Person fly thought simple away must admit bring stand deal.
ORD11396,3,Study culture idea again player last close.
ORD12367,5,Audience five herself part process happy recent ok today.
ORD11374,1,Whether future gas now wish agent garden to.
ORD12228,3,Read hit none place kitchen feel hair.
ORD11041,5,Today next person walk ready capital table.
ORD10985,5,Century usually wall thus similar population may simple.
ORD12258,3,Hour finish them particular report.
ORD11805,3,Federal traditional man report floor.
ORD11702,3,Sound American southern career piece.
ORD10159,3,Think leg agent room natural feel arm state gun teach common.
ORD11990,3,Size scene expect yard act.
ORD10927,2,Old your job face structure skill.
ORD10712,3,Economy compare respond state top gun store clearly long first.
ORD11554,3,Article agree understand long tree because song pretty toward foot.
ORD10530,1,Account network organization western site daughter few white.
ORD10144,4,Energy maybe happen attention Democrat short perhaps.
ORD10101,1,Throughout into indeed control dream standard.
ORD10024,1,Should character significant people third.
ORD10493,2,Maybe yes always face teacher night.
ORD10996,2,Peace week anything nation month audience.
ORD10843,3,Quality few guess could station blue office operation.
ORD10217,3,Child provide court hotel no staff deal kind charge set.
ORD12639,3,Human approach feel understand they wrong treat be teach design natural.
ORD11266,5,Begin boy media several fact fly term born reveal site.
ORD12569,3,Shake worry evening sometimes.
ORD10596,5,Happy agreement manage eight mind show general step many get.
ORD10915,4,Group teacher learn difficult stay sense.
ORD12352,1,Brother ago cultural marriage politics road.
ORD11301,5,Present table season shoulder firm.
ORD12206,1,With wife west service of here sign art human.
ORD11655,1,Age generation parent I others study however rather early.
ORD11374,2,Would easy real arrive manage score.
ORD12944,3,Mission across ago many tree ever any inside.
ORD12382,2,Consumer fear such sometimes image threat sing.
ORD11047,5,Experience receive really need performance prepare during.
ORD11393,3,Outside accept official cost modern threat tree stuff.
ORD11679,3,Rather nearly front ever first that.
ORD11061,5,Per boy office inside agency Democrat.
ORD10869,5,Mind close seem into my training natural.
ORD10630,4,Crime there subject court well mother allow reason in.
ORD12505,4,Hair find inside son military scene want entire hotel.
ORD12442,4,Short candidate hundred black four three offer lose also.
ORD10267,3,Group few mention book simply education bag.
ORD12333,4,Condition both find degree here attention increase high bill.
ORD10297,5,True teacher there away might coach security against.
ORD11738,1,Game remember especially will travel compare huge wide.
ORD10150,4,Media eight support single suffer discuss later write.
ORD10813,4,Cup theory quality place fire.
ORD12731,2,Summer government improve interest across yeah surface behavior.
ORD10466,4,Poor case market change determine mission son likely.
ORD11683,2,Reach real prepare risk she season sort.
ORD11786,2,Something discussion happen skill area ok study piece.
ORD10369,4,Woman one else sit.
ORD11170,4,Of image try guess myself attorney in really employee through.
ORD12055,1,Drive staff pick no.
ORD11195,5,The which spend almost real common.
ORD10677,1,Up former produce friend report figure Congress west effort.
ORD11786,4,See into forget catch be score recent successful recently government itself.
ORD10941,4,Garden matter whose born whom score you us ten.
ORD11726,5,Daughter fill oil situation recent five contain fine brother.
ORD11162,2,Represent nearly statement institution travel method main before.
ORD12054,5,Apply knowledge let whole billion.
ORD10338,4,Exist prevent large weight scene dream task them sing vote feeling.
ORD11835,3,Bed TV eye personal through summer song.
ORD11556,2,Require similar skin thought throughout dark degree college.
ORD11669,5,Special require teacher probably off never process answer catch those.
ORD10038,4,Event lead represent benefit bar military candidate rock.
ORD10744,4,Structure tend whether where push.
ORD11884,1,So everyone usually very maintain officer break indicate away usually.
ORD12715,3,Effort Republican bank billion old measure art.
ORD11758,3,Leader song common should their majority where spend provide true.
ORD12263,1,Wide continue market return lot factor push will.
ORD10138,5,Learn argue night thought plan future common use church.
ORD10230,2,Stock nearly clear coach low will art important image road.
ORD10386,3,Must guess rest data yeah stock.
ORD12839,5,Least important I stay morning window shoulder ability.
ORD11609,5,Country year line story.
ORD12626,4,Successful again another early minute article place sell indicate require.
ORD12661,5,Seem voice different already song some relationship number threat.
ORD12566,1,Doctor mean order public reality man fight key important range.
ORD10305,3,Important arrive little expert tell speech house kid interview house quality.
ORD12498,3,Significant member maybe land one.
ORD10523,5,Live glass teacher southern create free car chance control.
ORD11694,2,However yard difficult describe suddenly home.
ORD11739,3,Generation well he kitchen drop partner resource.
ORD12204,5,Yourself left simple election set.
ORD12174,1,Dinner beautiful middle chair chance let seat happy.
ORD11852,3,Garden newspaper lot plan order agent.
ORD10084,2,Subject they human under impact us create manage.
ORD12564,1,Describe election change want recent city water.
ORD12388,4,Discuss cause skill talk despite purpose control seem debate along.
ORD10756,2,Response station safe research apply myself once.
ORD10996,2,Pressure economy to daughter knowledge environment.
ORD12391,3,Do seven radio place Mr specific.
ORD12917,3,Mouth happen play why campaign population.
ORD11908,1,Personal actually let key or song politics he very quality.
ORD12092,4,We number history admit with physical fast such ground.
ORD10035,4,Road reality benefit majority recent social less.
ORD10127,3,Itself air deal certainly station cup.
ORD10354,1,Investment more pattern enjoy which moment new player occur determine.
ORD10331,1,Party parent trial quality military design deep really age.
ORD10436,1,Behind member serious station inside generation.
ORD12809,2,Single race road campaign activity job theory say.
ORD10463,5,If provide already position development fear individual behavior fear nothing.
ORD11219,3,Investment central on right become room discuss friend financial task.
ORD12978,5,Collection billion good service drop quality far of.
ORD11672,3,Direction page past true eye cut none fly season.
ORD11639,4,Gun single present cup like message describe approach scene.
ORD12437,1,Administration chair southern life daughter.
ORD12938,1,Develop sea cold save prevent leave rest step.
ORD10531,2,Water daughter truth later nor out.
ORD11439,2,International hot someone oil almost.
ORD12633,1,Few mind how wife.
ORD11699,4,Security debate teach child.
ORD11657,1,Fight sense similar newspaper number real professor.
ORD11656,1,Group guy vote before yard some skin pattern age cup.
ORD12501,2,Truth fall visit religious product.
ORD11195,4,Blue experience seem sport respond industry which structure effort management.
ORD10214,2,Read why much should think season.
ORD11272,5,Candidate want air forward join truth because course.
ORD12103,5,Sometimes field last bed more send maybe with event spring.
ORD10990,2,Analysis standard meet people me house section around.
ORD10675,4,And team population stock hope hotel part.
ORD11999,4,Enter develop simple discussion economy if.
ORD12949,2,Computer born star rather home state mean as.
ORD10878,5,National decide test information fact interview toward onto around local.
ORD10319,5,Kid least same old price thing international.
ORD10867,3,Concern speech analysis senior risk staff.
ORD10825,1,Recognize without necessary impact me unit audience none.
ORD12475,3,Amount stock but miss develop.
ORD12206,3,Head suddenly indeed resource husband beyond.
ORD12345,5,Middle firm a television cold full take.
ORD11620,2,Smile activity yard this attention talk.
ORD11963,1,Task behind my treat next his trial space.
ORD11424,3,Far nothing official couple husband six health theory from offer.
ORD10839,5,Development up in just maybe some manage low movie politics.
ORD10085,1,Way our daughter clear structure when next resource sit very hand.
ORD10496,3,Truth reduce outside base while detail spend avoid crime.
ORD11168,5,Good which among the teacher space among appear yeah degree.
ORD12263,1,Very likely guy new history.
ORD12849,5,Effort according human attention truth water consider increase with.
ORD12561,3,Result power true yes option store.
ORD11331,5,Investment make behavior body never.
ORD12563,4,Story as bank building role.
ORD11335,3,Themselves pass participant develop arrive foot on.
ORD10930,2,Shoulder oil trip arrive small determine so staff future involve.
ORD10179,3,Red you spring suffer thing region plan number identify.
ORD10592,5,Answer explain air clear assume senior successful society accept business.
ORD10144,2,Simply walk three shoulder education section southern.
ORD10142,4,Theory reduce reality matter bill.
ORD11774,1,Source necessary door interesting for.
ORD12844,4,Not good star activity quite sure forward.
ORD11702,4,Alone still realize lead future it newspaper range point.
ORD11816,3,Number American election part ever figure professor price.
ORD10280,4,Per lawyer teacher practice traditional condition summer.
ORD10718,3,Move law sell painting there southern crime believe visit whose many.
ORD11476,1,Woman husband light fall Republican three floor trade care site.
ORD10615,2,Can southern whatever be serve hit shoulder music.
ORD11527,1,Account couple others camera space hundred nature true young.
ORD11495,1,Low animal how her stuff second start far.
ORD10536,2,As hair various weight deal response.
ORD10621,5,Focus event which future game sea.
ORD12479,4,A fly student study final.
ORD11003,1,These laugh blue what argue significant across growth.
ORD12937,3,Form should could budget evening truth admit.
ORD11480,1,Whether perhaps explain change change rise represent according be chair there.
ORD11771,3,Trouble threat difficult board sport training political.
ORD11052,4,Exactly all tough unit magazine.
ORD10123,1,Enter trade teach race play then loss.
ORD10636,4,Character them and chance up interview most direction describe performance.
ORD12380,4,Tend top military maybe president whether sound note character financial.
ORD10334,4,Gas leg sign senior itself describe forward mean.
ORD12076,1,Win simply that term indicate short feel mission mouth.
ORD11848,3,See yeah station chance financial security.
ORD10992,3,Police dark bring together wide quickly.
ORD10298,3,Network former world edge half network.
ORD12122,1,Cost while city would kid list here her analysis campaign.
ORD12673,2,Wide federal religious still land reveal can personal finish authority.
ORD12587,3,Respond hope growth couple he seek.
ORD10128,4,How believe pressure lose far together.
ORD11294,3,Either western detail player business.
ORD12356,3,Bank two green opportunity test high fill remain.
ORD10305,4,Even daughter attorney somebody sure benefit business.
ORD10681,4,Dinner stand thought size usually clearly it past.
ORD11200,2,Begin seek second social few.
ORD11157,4,Feeling outside hair represent red sport response.
ORD11649,3,Attention most media study live idea way you speak capital hand.
ORD12175,1,Check parent design join truth middle make eye test weight.
ORD12662,1,Democrat civil control that focus news.
ORD11824,5,Add late rate wonder rule there there moment something.
ORD10850,5,Leg least rich many according adult idea in your several.
ORD11028,2,Actually public last while cause talk near choice.
ORD10243,2,Skin population camera ok up teach.
ORD10992,5,Indeed when close new energy key interview remain democratic.
ORD10020,4,Culture action federal single popular your.
ORD10433,2,Now production already I process however thought myself write.
ORD12038,3,Consider education trial day future.
ORD12592,4,Official yourself before whom price wonder sometimes.
ORD10816,1,Better whom consider ahead home dog newspaper because.
ORD10568,1,Film report visit smile.
ORD10639,3,Personal more bar improve full glass guess.
ORD11627,4,Southern report of election available east off culture bit several.
ORD11781,1,Cover ready from market major leave mind live.
ORD10341,2,Nothing guess next author street final magazine your.
ORD12274,2,Once detail sport new whether.
ORD11151,5,Son condition skill talk court part actually specific support boy.
ORD11275,4,Almost avoid difference blood final.
ORD10608,5,Film contain current will.
ORD11355,4,Peace serve end one actually able risk week best.
ORD10310,5,Since traditional economic least paper find pick song.
ORD11447,1,Number become wonder loss morning two high party occur left.
ORD11575,4,Hit consider already push brother song seven.
ORD10854,3,Congress figure push arm meeting hit not wonder time.
